{
  "id": "lunch_middle_eastern_bowl",
  "version": 1,
  "content_status": "draft_llm_generated",
  "meal_type": "lunch",
  "name": "Middle Eastern lunch bowl",
  "slots": [
    {
      "role": "protein_source",
      "preferred_ingredient_ids": [
        "lentils_cooked",
        "chicken_breast",
        "eggs",
        "greek_yogurt",
        "tofu_firm"
      ]
    },
    {
      "role": "carb_source",
      "preferred_ingredient_ids": [
        "chickpeas_cooked",
        "brown_rice_cooked",
        "whole_wheat_bread",
        "quinoa_cooked"
      ]
    },
    {
      "role": "fat_source",
      "preferred_ingredient_ids": [
        "tahini",
        "olive_oil",
        "almond_butter"
      ]
    },
    {
      "role": "vegetable",
      "fixed_grams": 100,
      "preferred_ingredient_ids": [
        "cucumber",
        "cherry_tomatoes",
        "mixed_salad_greens",
        "kale"
      ]
    }
  ],
  "cuisine": "middle_eastern",
  "eating_style_tags": [
    "home_cooked"
  ],
  "author": null,
  "created_at": "2026-07-13"
}
