{
  "id": "pretraining_middle_eastern_snack",
  "version": 1,
  "content_status": "draft_llm_generated",
  "meal_type": "pre_training",
  "name": "Middle Eastern pre-training snack",
  "slots": [
    {
      "role": "protein_source"
    },
    {
      "role": "carb_source"
    }
  ],
  "cuisine": "middle_eastern",
  "eating_style_tags": [
    "simple_quick"
  ],
  "author": null,
  "created_at": "2026-07-13"
}
