{
  "id": "pretraining_mediterranean_snack",
  "version": 1,
  "content_status": "draft_llm_generated",
  "meal_type": "pre_training",
  "name": "Mediterranean pre-training snack",
  "slots": [
    {
      "role": "protein_source",
      "preferred_ingredient_ids": [
        "salmon",
        "cod",
        "canned_tuna",
        "eggs",
        "greek_yogurt",
        "cottage_cheese"
      ]
    },
    {
      "role": "carb_source",
      "preferred_ingredient_ids": [
        "whole_wheat_pasta",
        "quinoa_cooked",
        "chickpeas_cooked",
        "whole_wheat_bread"
      ]
    }
  ],
  "cuisine": "mediterranean",
  "eating_style_tags": [
    "simple_quick"
  ],
  "author": null,
  "created_at": "2026-07-13"
}
