{
  "id": "dinner_middle_eastern_plate",
  "version": 1,
  "content_status": "draft_llm_generated",
  "meal_type": "dinner",
  "name": "Middle Eastern dinner plate",
  "slots": [
    {
      "role": "protein_source"
    },
    {
      "role": "carb_source"
    },
    {
      "role": "fat_source"
    },
    {
      "role": "vegetable",
      "fixed_grams": 120
    }
  ],
  "cuisine": "middle_eastern",
  "eating_style_tags": [
    "home_cooked"
  ],
  "author": null,
  "created_at": "2026-07-13"
}
