{
  "id": "pretraining_simple_snack",
  "version": 1,
  "content_status": "draft_llm_generated",
  "meal_type": "pre_training",
  "name": "Simple pre-training snack",
  "slots": [
    {
      "role": "protein_source",
      "preferred_ingredient_ids": [
        "chicken_breast",
        "turkey_breast",
        "eggs",
        "greek_yogurt"
      ]
    },
    {
      "role": "carb_source",
      "preferred_ingredient_ids": [
        "potato",
        "sweet_potato",
        "whole_wheat_bread",
        "brown_rice_cooked",
        "oats_rolled"
      ]
    }
  ],
  "cuisine": "american",
  "eating_style_tags": [
    "simple_quick"
  ],
  "author": null,
  "created_at": "2026-07-13"
}
