{
  "id": "lunch_latin_bowl",
  "version": 1,
  "content_status": "draft_llm_generated",
  "meal_type": "lunch",
  "name": "Latin lunch bowl",
  "slots": [
    {
      "role": "protein_source"
    },
    {
      "role": "carb_source"
    },
    {
      "role": "fat_source"
    },
    {
      "role": "vegetable",
      "fixed_grams": 100
    }
  ],
  "cuisine": "latin",
  "eating_style_tags": [
    "meal_prep_friendly"
  ],
  "author": null,
  "created_at": "2026-07-13"
}
