{
  "id": "dinner_american_plate",
  "version": 1,
  "content_status": "draft_llm_generated",
  "meal_type": "dinner",
  "name": "American dinner plate",
  "slots": [
    {
      "role": "protein_source",
      "preferred_ingredient_ids": [
        "chicken_breast",
        "turkey_breast",
        "eggs",
        "greek_yogurt"
      ]
    },
    {
      "role": "carb_source",
      "preferred_ingredient_ids": [
        "potato",
        "sweet_potato",
        "whole_wheat_bread",
        "brown_rice_cooked",
        "oats_rolled"
      ]
    },
    {
      "role": "fat_source",
      "preferred_ingredient_ids": [
        "peanut_butter",
        "cheese_cheddar",
        "almond_butter",
        "butter"
      ]
    },
    {
      "role": "vegetable",
      "fixed_grams": 120,
      "preferred_ingredient_ids": [
        "broccoli",
        "green_beans",
        "cherry_tomatoes"
      ]
    }
  ],
  "cuisine": "american",
  "eating_style_tags": [
    "home_cooked"
  ],
  "author": null,
  "created_at": "2026-07-13"
}
