{
  "id": "pretraining_latin_snack",
  "version": 1,
  "content_status": "draft_llm_generated",
  "meal_type": "pre_training",
  "name": "Latin-style pre-training snack",
  "slots": [
    {
      "role": "protein_source",
      "preferred_ingredient_ids": [
        "chicken_breast",
        "shrimp",
        "tofu_firm",
        "eggs"
      ]
    },
    {
      "role": "carb_source",
      "preferred_ingredient_ids": [
        "black_beans_cooked",
        "corn_tortilla",
        "sweet_potato",
        "white_rice_cooked"
      ]
    }
  ],
  "cuisine": "latin",
  "eating_style_tags": [
    "simple_quick"
  ],
  "author": null,
  "created_at": "2026-07-13"
}
