{
  "id": "dinner_latin_plate",
  "version": 1,
  "content_status": "draft_llm_generated",
  "meal_type": "dinner",
  "name": "Latin dinner plate",
  "slots": [
    {
      "role": "protein_source",
      "preferred_ingredient_ids": [
        "chicken_breast",
        "shrimp",
        "tofu_firm",
        "eggs"
      ]
    },
    {
      "role": "carb_source",
      "preferred_ingredient_ids": [
        "black_beans_cooked",
        "corn_tortilla",
        "sweet_potato",
        "white_rice_cooked"
      ]
    },
    {
      "role": "fat_source",
      "preferred_ingredient_ids": [
        "avocado",
        "olive_oil"
      ]
    },
    {
      "role": "vegetable",
      "fixed_grams": 120,
      "preferred_ingredient_ids": [
        "bell_pepper",
        "zucchini",
        "cherry_tomatoes"
      ]
    }
  ],
  "cuisine": "latin",
  "eating_style_tags": [
    "meal_prep_friendly"
  ],
  "author": null,
  "created_at": "2026-07-13"
}
