{
  "id": "pretraining_asian_snack",
  "version": 1,
  "content_status": "draft_llm_generated",
  "meal_type": "pre_training",
  "name": "Asian-style pre-training snack",
  "slots": [
    {
      "role": "protein_source",
      "preferred_ingredient_ids": [
        "tofu_firm",
        "edamame_shelled",
        "shrimp",
        "salmon",
        "eggs"
      ]
    },
    {
      "role": "carb_source",
      "preferred_ingredient_ids": [
        "white_rice_cooked",
        "brown_rice_cooked",
        "rice_cakes"
      ]
    }
  ],
  "cuisine": "asian",
  "eating_style_tags": [
    "simple_quick"
  ],
  "author": null,
  "created_at": "2026-07-13"
}
