{
  "id": "dinner_mediterranean_plate",
  "version": 1,
  "content_status": "draft_llm_generated",
  "meal_type": "dinner",
  "name": "Mediterranean dinner plate",
  "slots": [
    {
      "role": "protein_source",
      "preferred_ingredient_ids": [
        "salmon",
        "cod",
        "canned_tuna",
        "eggs",
        "greek_yogurt",
        "cottage_cheese"
      ]
    },
    {
      "role": "carb_source",
      "preferred_ingredient_ids": [
        "whole_wheat_pasta",
        "quinoa_cooked",
        "chickpeas_cooked",
        "whole_wheat_bread"
      ]
    },
    {
      "role": "fat_source",
      "preferred_ingredient_ids": [
        "olive_oil",
        "tahini",
        "avocado"
      ]
    },
    {
      "role": "vegetable",
      "fixed_grams": 120,
      "preferred_ingredient_ids": [
        "cucumber",
        "cherry_tomatoes",
        "spinach",
        "kale",
        "zucchini"
      ]
    }
  ],
  "cuisine": "mediterranean",
  "eating_style_tags": [
    "home_cooked"
  ],
  "author": null,
  "created_at": "2026-07-13"
}
