{
  "id": "lunch_asian_bowl",
  "version": 1,
  "content_status": "draft_llm_generated",
  "meal_type": "lunch",
  "name": "Asian-style lunch bowl",
  "slots": [
    {
      "role": "protein_source",
      "preferred_ingredient_ids": [
        "tofu_firm",
        "edamame_shelled",
        "shrimp",
        "salmon",
        "eggs"
      ]
    },
    {
      "role": "carb_source",
      "preferred_ingredient_ids": [
        "white_rice_cooked",
        "brown_rice_cooked",
        "rice_cakes"
      ]
    },
    {
      "role": "fat_source",
      "preferred_ingredient_ids": [
        "sesame_oil",
        "avocado",
        "coconut_milk"
      ]
    },
    {
      "role": "vegetable",
      "fixed_grams": 100,
      "preferred_ingredient_ids": [
        "broccoli",
        "bell_pepper",
        "spinach",
        "zucchini",
        "cucumber"
      ]
    }
  ],
  "cuisine": "asian",
  "eating_style_tags": [
    "home_cooked"
  ],
  "author": null,
  "created_at": "2026-07-13"
}
