{
  "id": "breakfast_simple_bowl",
  "version": 1,
  "content_status": "draft_llm_generated",
  "meal_type": "breakfast",
  "name": "Simple breakfast bowl",
  "slots": [
    {
      "role": "protein_source",
      "preferred_ingredient_ids": [
        "chicken_breast",
        "turkey_breast",
        "eggs",
        "greek_yogurt"
      ]
    },
    {
      "role": "carb_source",
      "preferred_ingredient_ids": [
        "potato",
        "sweet_potato",
        "whole_wheat_bread",
        "brown_rice_cooked",
        "oats_rolled"
      ]
    },
    {
      "role": "fat_source",
      "preferred_ingredient_ids": [
        "peanut_butter",
        "cheese_cheddar",
        "almond_butter",
        "butter"
      ]
    },
    {
      "role": "fruit",
      "fixed_grams": 100,
      "preferred_ingredient_ids": [
        "apple",
        "banana",
        "mixed_berries"
      ]
    }
  ],
  "cuisine": "american",
  "eating_style_tags": [
    "simple_quick",
    "meal_prep_friendly"
  ],
  "author": null,
  "created_at": "2026-07-13"
}
